{
  "schema_version": 1,
  "analysis_id": "double-counted-cogs",
  "currency": "USD",
  "money_scale": 2,
  "price_basis": "nominal",
  "price_date": "2026-10-01",
  "horizon": {
    "start_date": "2026-10-01",
    "period": "year",
    "periods": 1
  },
  "cohort": "ecommerce-buyers",
  "counterfactual": "legacy-checkout",
  "accounting_boundary": "contribution margin feature with overlapping operational cost",
  "discount": null,
  "scenarios": [
    {
      "id": "base",
      "label": "Base scenario",
      "assumptions": ["Flawed accounting boundary"],
      "items": [
        {
          "id": "cm-revenue",
          "side": "benefit",
          "category": "conversion",
          "mechanism_id": "express-checkout",
          "period": 1,
          "amount": "100000.00",
          "currency": "USD",
          "basis": "contribution_margin",
          "netted_cost_categories": ["operations"],
          "rationale": "Net margin after operational fees",
          "evidence_ids": []
        },
        {
          "id": "ops-cost",
          "side": "cost",
          "category": "operations",
          "mechanism_id": "cloud-server-costs",
          "period": 1,
          "amount": "20000.00",
          "currency": "USD",
          "basis": "cash_cost",
          "netted_cost_categories": [],
          "rationale": "Explicit server operations cost (double counted)",
          "evidence_ids": []
        }
      ],
      "nonmonetary": []
    }
  ]
}
